"","content","rating","date"
"364","I'd have more respect had it been an IRL show; but since it isn't... It unsurprisingly revolves around the borderline white trash mishappenings of the standard US family nucleus. Situations usually created by the detestable father, since he's the dumbest of them all. The mother is the enabler. The daughter is the ugly geek; and so the oldest son. The only difference is that he's also fat and stupid; just like the father, and by extension, the show itself. Which is updated to a more modern and adult setting that comparable ones; sadly that doesn't add much to the show's enjoyment. Think of it as a bad ripoff of The Simpsons; obv unfunny and infinitely worse. The only two quasi salvageable chars are the youngest son, and the dog. Which are obv alter egos of the creator. Perhaps he should do a show solely about those two; IMHO.Another series of adjectives that come to mind are awful, unoriginal, infantile, nonedgy, lame, over-rated/hyped, dumb, boring, and expensive trash. It should've been canceled a long time ago, and jumped the shark right after the first season; as a matter of fact, it has been cancelled before; twice! If was never funny to begin with. And it's no wonder, since there are seldom any true jokes; just a series of bad puns and references. And even when they are, they're not funny enough. Seth has proved that he has no originality and can only do one type of show, rehashed over and over again under diff names; voices withstanding. ""Funny"" offerings for about 5 seconds an episode never did cut it. Definitely the Cloverfield of TV. And sadly once again, IMDb ratings and critics' reviews have failed me. I just cannot fathom why; except maybe fanboys trolling and voting down/up every negative/positive rev. Because no decent, average, clean, and normal human being could possible find this entertaining, let alone watch this putrefactive vomit out of free will. After growing up and leaving the pot, or whatever; I'd recommend a much better show, like South Park. A truly funny, intelligent, groundbreaking satire for serious and discernible adults. Or perhaps even said FOX's classic yellow family signature show. Anything is better that this P.O.S! I just don't see this appreciated a few years from now. People that like it should be ashamed of themselves, and will also be ridiculized for the morons that they truly are; eventually. Maybe sheeple have lost any standard and ref levels; and nowadays they pretty much laugh at anything that's supposedly sold to them as funny. Lil' kids also liek Barney as best show evar1 you know...","3","29 September 2013"
"365","This is one show whose life was ended way too soon.  Despite being Emmy material and one of the funniest cartoons ever, Fox had to replace this with Celebrity Boot Camp and Joe Millionaire garbage.Family Guy is one of the few things in life that is more addictive than crack.  After five minutes of one episode, you'll be hooked.  Seth MacFarlane comes up with the craziest concepts.  A talking baby bent on killing, a dog who loves cocktails, plus the funniest and most random dialogue ever.  I liked this one flashback scene where Peter, who's 13 years old, asks his teacher, ""Why did the dinosaurs die?""  His teacher responds, ""'Cuz you touch yourself at night.""  I was laughing so hard when I saw that scene!Seriously, I don't know what Fox sees in pure rubbish like Paradise Hotel and Mr. Personality.  I'm sick of shows where all the people are unfunny, unoriginal, supermodel material.  Family Guy is absolute genius.","10","3 July 2003"
"366","Family guy is the most crudest, dumb, sometimes racist program i have ever seen. But damn is it funny.Most people that have seen or heard of family tend to compare it to the Simpsons but that it just wrong. I admit there are some familiar things about it but calling it a rip-off is just arrogant. Family guy is like the one sturdy branch descended from the bark that is Simpsons. For one thing family guy offers much more jokes and a lot less story; if you prefer storyline and concept then go with simpsons. But for outright laughs and stupidity go for Family guy.And stupidity and laughter cannot be given without a great mixture of characters which family guy most Definitely has. We have the likes of the father peter; a fat blathering idiot, Lois; The strong mother who has her occasional outbursts, Meg; the typical teenage daughter, Chris; the weird awkward type that sometimes borders insane, and of course, what show cannot go without and evil mastermind baby and a sarcastic drinking, talking dog.This and a mixture of other great characters and constant mockery of shows, films, religion and race makes what Family guy is; A true classic.",NA,"8 October 2004"
"367","As of this writing, Family Guy is the number one critical comedy/parody, addressing current and all-time issues from a unique perspective. Let's just hope Family Guy won't lose it's teeth over the course of time.If you don't get the the humor of this show, then you've either been living under a rock or TV is not for you.Shame on Fox for not promoting Family Guy better and instead putting it on hold a couple of times- for Family Guy is a true gem.10/10",NA,"16 January 2002"
"368","I loved this show so much. This show is freaking great. For almost 18 years this show had displayed how controversial and cynical life can be in a hilarious way. I don't care what other people on this site said over the years about Family Guy. They just love to whine like pathetic children about not living up to their uptight and politically correct expectations. People who seek morals from cartoons are seriously idiotic. It's just a cartoon that loves to insult everyone and that's what I love about. Extremely awesome college humor and very brilliant satire created by the comedy genius himself Seth MacFarlane and his wonderful cast and writers. I loved all 15 seasons so far. I can't wait for season 16 and more. Serializing the show will be the most interesting and updated thing for Family Guy's popularity and integrity. Stay strong Family Guy! Seth needs to take control of his show immediately because the entire show and fandom needs a reality check and be reinvented. Redeem your show's integrity.","10","8 December 2016"
"369","Hmmmm where should i start?
Well im gonna be honest
i used to love this show,
both started off great. but when a cat starts ages, there comes time when it gets weaker and weaker, just like family guy.
The funny part is that The Simpsons and Family Guy both started off amazing!
Yet ended up in a trashcan.1st-4rd seasons were GREAT!
It was funny, just funny... And interesting,
I actually felt bad for Peter,
Yet in the newer Episodes he's such a jerk!
The 5th season was meh, i didnt like some of the episodes.
And me suprisingly liked the Peter Prostate Exam Episode, It did make me laugh, Even if there was jokes about rape n stuff and me who's such a over-sensitive person, i liked it. so did i like some other few episodes, but i felt some episodes were worser then the past seasons, i thought it was just gonna last for a season. BUT NOPE EVERYTHING JUST GOT WORSER GAHH! There are some few episodes of newer family guy though that i liked, Like Reverse time OR Road to multiverses, but oh well. 
Im a person who cares more about the past then the current time.
Therefore im giving 8/10 on season 1-5 and rest of the seasons a 4/10 (just because there are still some few good episodes)ALSO THIS IS NOT A SIMPSON RIPOFF!
i consider myself a huge old simpson fan, and this is not a ripoff
the simpsons have sneaked some family guy refrenced BUNCH OF TIMES both in the older and newer episodes, HECC THEY EVEN COLLABRATED TOGHETER!
SO STOP SAYING ITS A SIMPSON RIPOFF!","6","13 July 2018"
"370","family guy is excellent as it does some really funny bits like take the Micky out of star wars so many times (to add to that Seth is a star wars fan as you don't reference star wars as much as he has without being a fan of the show) peter is funny in his own right especially when he is being sexist, loris is great much better than Marge from the Simpson's who has weird hair and talks like something from star trek, meg is a bit annoying but i love it when they make fun of her and blame her for everything, Chris is a little slow but is funny with that voice by Seth green (funny guy) stewie is brilliant, witty, funny and is brilliant with Brian who is my favourite character as he is sarcastic, takes advantage of stewie and his love for Loris is really funny as you wonder is it ever going to happen (porbably not but it would be funny if it did happen) other characters like quagmire, Cleveland and Joe are funny,good and make the show more interesting i think family guy will go on to outlast the Simpson's in production as they can get away with a lot more than the Simpson's can but family guy is genius in its own right and people who criticise it are jealous of its successes and that its own or favourite shows are becoming more rubbish i.e. the Simpson's and south park","10","7 August 2007"
"371","""Family Guy"" is one of the best series to ever come on Fox since ""The Simpsons"". Each and every episode I've seen was hilarious, except for the ""lost"" episode, which was the least fun out of all the episodes. Nearly everything about the series is great, but I do have a couple gripes with the show; it isn't as witty, funny, nor original as ""South Park"", ""The Simpsons"", and ""MST3K"", but those shows are pretty much unbeatable in my opinion. The episodes also don't repeat as well as as the previous shows, but this is still a can't miss series. While it isn't as good as the other shows I mentioned, this is one of the greatest adult series to ever grace television of this generation. Fox is very stupid for canceling this show, and I seriously hope that this great series doesn't get picked up by this channel, since they focus on more crap like ""American Idol"", ""Method & Red"", and ""Quintuplets"".",NA,"30 July 2004"
"372","Ignore the comment before mine. The show is comic genius, most underrated show ever. 3 reasons why. Reason 1, the flashbacks are hilarious, who cares if they have absolutely nothing to do with the story, they make me laugh so hard it hurts and isn't that the idea of a good comedy programme? People who think this isn't funny just have no sense of humour. Who cares if they are random, its a t.v. show, you can do what ever you like with it and people say its not realistic, neither is a cartoon, its animated. Reason 2, The jokes are just generally hilarious, Seth McFarlane and the other writers are soooooooooooo funny, everything from the Star Wars references to making fun of celebrities, i love them all. And Reason 3, the story lines are just brilliant and funny, they set up all of the jokes with their crazy nature and wackiness, just all the more funnier.I caught this one late night on BBC2 and have never gone back, i have all 7 seasons, plus the kind of movie thing (Stewie Griffin: The Untold Story), i have several t-shirts, posters and my collection is still growing. I've never got a collection of any TV show before but this was so funny i just had to get everything. Just watch season 3 and trust me you will be hooked for life, the funniest show ever created and i hope it never ends!","10","30 November 2008"
"373","The greatest thing about watching family guy is that you know its going to be different. It is really unpredictable and very originall. simple story line. Surburban, Irish, working class family living in Rhode Island and there daily life which is always strange but very funny. The show has everything to make it memorable. A sophisticated talking dog, a baby obsessed with ruling the world, a Homer Simpson like dad. When you first watch it you might struggle to understand whats going on but i think thats the pointThink the classic humour of The Simpsons with a mix of south park. expect witty remarks and hilarious situations. you probably wont relate to this like you would with The Simpsons. But if you don't take this too seriously this is one of the funniest animated shows there is.",NA,"10 April 2006"
"374","What can i say about Family Guy? Oh yes. It is absolutely funny and has a lot of laugh-out gags and jokes but this is the show that has the most memorable characters like Peter Griffin and Stewie Griffin. Wow, Seth MacFarlane is far or more the genius of animation just like Matt Groening except more crude and adult-like. The humor in this show is absolutely the best and far way over the top.I love Herbet the Pervert in this series, oh my god it is just my memorable moment for Family Guy because of him being a elder pervert and has my opinions on the funniest character in the show. In memorial of Brian Griffin in Life of Brian, horrible episode then revived, aaaah better 10/10","10","23 July 2014"
"375","The show is one of my favorite animated television shows, but some of the jokes are actually racist. You know, one that bothers you in your religion or color, etc. etc. Since I'm a Christian, nearly always they have something that mentally scars my religious ways for a couple of days.Sure, I agree that Quagmire's really weird personalty is cool, but this is like the Simpsons, except with more weird into it. I don't really say this is a cross between the Simpsons and South Park, but some of the jokes are really corny, not really racist, though.The voice actors are decent, sometimes they're really annoying. I'm used to it, though.","9","20 October 2008"
"376","Here's the thing, this is one of my favorite shows. I own all the current DVD sets and plan on getting the next one when it comes out. The great thing about this show is that it's just something fun to watch.It's all personnel preference some people dislike this show because of some of the humor. A lot of the humor has a sexual tone and other so called ""edgy"" humor that some might object to, so if that's you just go ahead and stop reading because this show isn't for you.There are very few shows that I can watch over again and this is one of them. It has some of the best comedy sequences and quotations I've heard or seen. Now yes don't get me wrong there are some parts that do drag on, but what do you expect not every joke is gonna be pitch perfect there's always a few low points and some episodes you won't like.There's a few you do to keep a little bit of your immaturity, You can't be serious all the time so if you want a good enjoyable show watch that'll make you laugh this is one that is definitely worth it.","10","29 January 2011"
"377","Family guy by far is my favorite adult animated show, I have been watching for almost 10 years now and I still think it's as funny now as it was when I first watched it. I was a kid then so not all the jokes got through but now re watching past episodes and understanding some of the adult jokes I have an even funner time watching this show. Although the only problem with the show I have is the fact that I've been watching for 10 years and some characters can get a bit annoying now, so every once in awhile I'll give myself a few months away from the show. My favorite character on the show is Chris griffin because he's played by one of my favorite childhood actors in Seth green. Also I love how Chris just adds onto his fathers dumbness when it comes to picking on Meg. Chris is one character that after 10 years I am still able to say I love that character. Overall I'd say family guy is a hilarious show with no real down points unless you've been watching for a long time like me.","9","8 August 2015"
"378","Started to watch this Sitcom. So much funny clip are coming in my fb, tiktok and YT feed some dark some so funny so i decided to watch this. So let's see how is this series. Too long don't know when will I finished this, still the office is on pending i am on s4.",NA,"4 January 2022"
"379","It's just started being shown over here in the UK, so I thought I'd try it. It's good. It's really good. Very funny, the scripting is spot on, and the characters grow on you right away, they don't need introductions, they are just there, in your face, and you love them. Especially Stewie, he is brilliant.If you like animation, try it out, that's what I did, and I loved it...",NA,"9 October 1999"
"380","Family Guy is just like the Simpsons. 2/3 ""whoo-hoo!"" and 1/3 'D'OH!'The non-threatening comedy is hilarious(i.e: Peter knocks a golf ball into a china shop, destroying everything while a bull is reading the magazine. The angry owner sneers at the bull who replies, 'I know what you're thinking!'), the suggestive but nor so harsh humor is cute, but the adult language has got to go! That is stupid, and Seth McFarlane, the man behinf Family Guy knows it. There's a person who can't stand the show, and for good reason. Too harsh for its own good. Sure, I can use Stewie to help me get rid of some scum I hate, some of them are critics with no taste who got me POed with their lousy reviews. But overall, the show needs less raunch and more slapstick! Offensive comedy ain't funny. It's offensive! And stupid. Peter Griffin is an idiot with a woman's butt for a chin.",NA,"4 December 2003"
"381","Despite the criticism that it received(about the voices, themes and the simplicity of the animation), I think that ""Family Guy"" deserves all the popularity that it has.It is true that at first sight it seems to be a clone of the Simpsons, but the style and the humor is quite different and quite effective too. The cultural references are effective, and shocking sometimes (That is what makes the show funny) and about the animation, I think that it fits very well with the style of the show. And the complaints concerning taste and indecency are exaggerated: It is true that the show has violence and sexual jokes, but it was never intended to children. There are many shows that are more offensive and explicit and that don't receive the same criticism ( Like, by example ""Drawn Together"")Even when the humor isn't ""sophisticated"" it doesn't makes it stupid or puerile. It is just the style of the show. With it good and bad things "" Family Guy "" is a very good show.Not the best, but good.","9","4 July 2008"
"382","As Lionel Hutz himself once said, if it weren't for ripoffs, we wouldn't have nearly as many enjoyable shows as we currently do. But to call Family Guy merely a ""Simpsons ripoff"" is very short sighted. Family Guy is an acquired taste, and if you didn't like the first episode, you most likely will never be able to get into it. I find it to be hilarious, unlike shows like Futurama that stay on the air all year thanks to the star power behind them. There is a way to explain how Family Guy is not only different from the Simpsons, but is also a suitable replacement when the inevitable time comes, but chances are that if you don't understand Family Guy, you wouldn't understand the explanation either. Bottom line: It's a very good show, and Fox needs to wake up and realize that they have a potential cartoon dynasty on their hands if they would just replace Futurama with Family Guy on Sunday Nights.",NA,"4 December 2000"
"383","Contrary to what the title says, I like both shows but ""Family Guy"" has some scenes that make me laugh so hard I almost choke. The funniest one that I can think of is the ""Mentos"" parody. I laughed SO hard tears were rolling down my face and I was still laughing way after that scene was over!! I can't WAIT for the season premiere of FG to start but the bad part is that it's going to be on Thursday nights opposite ""Frasier"" and ""Chicago Hope"" so my mom, dad and I are going to fight over the two TVs we own come September. BUT I WILL WIN IN THE END!! HA HA HA!!!!Anyway, I would recommend this show to people. They'd be kicking themselves when the show is cancelled(hopefully that's not for a LONG time)and are not able to catch it on the tube anymore.",NA,"16 August 1999"
"384","Family Guy is a cartoon that you sometimes wonder why it was rated PG. Whether it's newsman Tom Tucker being found with a prostitute, Griffin child Stewie commenting on how the cheerleaders are lucky he's not after there more...intimate regions or Quagmire...well anything Quagmire says, really. But mixed in with this shocking humour is some really sharp dialogue and surreal flashes that combined with the shows lack of PC makes for a very good mix. Like the Simpsons it more feels at home satirising aspects of society than actual events themselves and like the Simpsons it has a good mix of characters including Brian and Stewie the cynical smoking dog and the dominating evil baby respectively who really set the show apart from the Simpsons. Having said that however, the show doesn't seem to get away enough with Peter the dumb father beginning to remind us all of a bald round father from another show...Also, while the show is great the first time around, it doesn't have the depth of Futurama nor the Simpsons to lift it to their class. Nevertheless, Family Guy is a good show and I can't wait for the movie later this year.",NA,"30 January 2005"
"385","Family Guy is a hilarious example of the explosion of more adult-themed animation that has taken place over the past ten years. One of the earliest and most successful of the genre, it plays like a combination of The Simpsons and South Park, blended together with a puree of pop culture references.Family Guy has evolved over the seasons-and the two cancellation periods. If you watch the earliest episodes, they are much tamer than those that followed in the second and third seasons, almost as if the writers were unsure of how far they could go. Furthermore,the characters, within the limits of a half hour sitcom, have themselves evolved. Brian in particular has been fleshed out well.This is never going to be great drama, and it is certainly not something you would show to the children. Nevertheless, if you want a good laugh, this show is the place to go.","8","4 January 2011"
"386","Of all the current animated sitcoms (""Futurama,"" ""The PJs,"" ""King of the Hill,"" ""Dilbert,"" ""The Simpsons,"" ""South Park,"" ""The Family Guy""), only one stinks. It's ""The Family Guy."" The stories are stupid, the characters are one-dimensional ripoffs, and the animation is flat and uninteresting.The megalomaniacal baby and the hyperintelligent dog are both ripped off from Dogbert, and they are the only characters that have any personality at all. Unfortunately, the baby is merely annoying (and majorly so).Hopefully Fox will cancel this stinkeroo soon and put the far superior ""Futurama"" back in its cushy 8 p.m. Sunday time slot.",NA,"8 April 1999"
"387","This is one awesome show, and here are the reasons why. First, there are random scenarios episode after episode. Second, the series has dozens of popular culture. For example, in the episode, ""I dream of Jesus"", Peter rediscovers his favourite song of all time: Surfin' Bird. I have been inspired to love Surfin' Bird and drive my family crazy with it. The first time I have watched an entire episode of Family Guy, was when I was eleven, and I was totally hooked on it, even though it's vulgar, it's funny! What else I love best about Family Guy is that it even did the Star Wars Trilogy, and I totally loved it!! The most hilarious episode would be ""The Splendid Source"", where it involves Peter laughing at a dirty joke so hard, he poops his pants. Every time that happened, I burst out laughing so loudly, my parents could hear me all the way upstairs, because I was in the basement.","10","14 May 2011"
"388","> This show is the single greatest thing to come out of America since The > Simpsons.  Not only does it have thousands of new ideas, but it's actually > controversial (see the Jewish joke, Season 1, Episode 1) and isn't scared to > ""tick"" people off.  However, the great minds at Fox have canceled it, along > with Greg the Bunny and Futurama, so make sure you buy the Season 1 box set > while you still can.  It'll be the best money you ever spend.  It's > definitely a show that gets better the more you watch it, as at first the > constant flashbacks can get a little annoying and don't always seem to fit > the story properly.  However after a couple of episodes you realise how > brilliant it is, and how well it compares to any other show currently on air > at the moment.","9","16 July 2002"
"389","It is a very good show. Amongst the top cartoons I have ever seen. Now people say it is a bad show for all the jokes where they cut away. But i think it is intelligent and feel that this show has great potential. It is but some shows can have very good plots and revelations. But I have to say I am being disappointed with some episodes of season 12 and 13, especially the brain death sequence. But other then that it is a great show and i recommend it.It is a great comedical show, even if you are not taking it seriously then still sitting down every few days and watching a few episodes for the laughs is fun. But like every show it has it's bad episodes which disappoint me and very good episodes. overall a great show, but be wary it ISN'T a family show lol","10","8 June 2014"
