"","content","rating","date"
"179","Family Guy is an animated cartoon created by Seth MacFarlane and first aired in 1999. MacFarlane voices many of the Family Guy characters, though there are other voice actors. The daughter, Meg, is voiced by Mila Kunis, the older son, Chris, is voiced by Seth Green, and the mother, Lois, is voiced by Alex Borstein. In my opinion, MacFarlane has surprised me, and has proved himself to be wonderful at providing different voices. I was amazed when I found out how many voices he performed. To that, I give him two thumbs up.The show itself is funny at times. When I first saw it, I laughed at some of the randomness and crazy jokes. But lately, I've been thinking...is it really that funny? I have re-watched many episodes, and a lot of them are rather pointless, mainly season 4. Seasons 1-3 were the best at combining randomness with a good plot-line. It actually had some rather creative ideas, like the ""big-ass pinata"" for instance. I laughed at that. Season 4 overdoes it way too much, as well as other things.One of the problems I have with season 4 is its flashbacks and cutaways. Even more annoying is the ""regular speech."" It was funny for an episode or two, but they use it as a basis for its comedy, which is not a good thing. It seems that many episodes of season 4 have this now, and I have no clue how long it will last. In these situations, I usually am frustrated and desperate to move on.Another thing that has been done incorrectly is its overuse of slapstick. For season 4, that seems to be the basis of its comedy, which again, is a bad thing. The throwing up thing was mildly funny, but it lost its touch after about 5 or 10 seconds worth of throwing up. Okay, we get it, they're throwing up, it's funny, you don't need to show us anymore, we get the point! Finally, another thing I am absolutely tired of is all the ""Meg bashing."" Seriously, what did she ever do to get picked on so much? I mean, she might not supposed to be popular, but it's even worse to be picked on. A lot of Family Guy fans will criticize me for having this opinion and rebuttal by saying it's funny. To me, it's not funny. It is tasteless and lacking in any point. Do people really think it's funny to pick on someone that hasn't done anything wrong? I don't, and there's nothing funny about that. I mean seriously, where's the humor? What's supposed funny about it? I think she is cute and should get revenge in season 5.Something else to consider about this show is Seth MacFarlane himself. He has been criticized by many, and he often takes jokes too far. The Elizabeth Smart joke was not funny and just horrible.This show is good, but I think it should clean up its act and make improvements here and there. Would I recommend viewing it? I would recommend seasons 1-3 and maybe some episodes of season 4. But some of the last episodes, Petergeist and Untitled Griffin Family History, are among THE WORST Family Guy episodes EVER, so I would not recommend those.","9","4 July 2006"
"180","......is that they finally realized what a piece of crap this show was and took it off the air.  Family Guy is one of the worst cartoons to come out. Peter Griffin is just a jerk.  He doesn't care for anyone but himself.  He is supposed to be a ""clone"" of Homer Simpson(which was made fun of in a recent Simpsons Halloween special), but what the writers ignored was Homer, though rude and selfish most of the time, actually does feel remorse and regret at times(he even once actually tried to improve his family from being the slobs they were!), but that part was ignored when Peter here was created.  Like I said, he is thoughtless, uncaring, and selfish, and only looks out for himself.  The episodes are pointless, with scenes that are supposed to be humorous, but are either boring or just plain stupid.  The stories are also extremely offensive, not South Park offensive, but offensive enough to be really crude, vile, and tasteless.  Ignore this ""comedy,"" and watch an old episode of the Simpsons instead.BOTTOM LINE:  I'll start laughing all right.... the day Peter Griffin gets what he deserves.",NA,"17 August 2003"
"181","Next Season 20s; Seth Macfarlane's Family Guy work of actors with Cleveland Brown whom he is totally useless to find real fit Black voices actors; any real voice do Black Panther James Mathis III, Chi McBride, Eddie Murphy, Keith David, John Witherspoon, Kevin Michael Richardson, Regina King and Boondocks, Taye Digg, Isaac Haye, Micheal Jaleel White and Jason Weaver. Fake white accent MIke Henry need find another for American Quahog. Voice needs to do more real-life Black actors. Where real Token Black real-life resemblance and please Macfarlane change the voice of Cleveland Brown and Rallo. Thanks god Sesame street gangs have proof but maybe the muppets families spoof should do more like Quahog Sesame Street. By the Cleveland families need offensive other fans of Cleveland wont get upset Cleveland Show does not show cheesy annoying.","10","5 December 2018"
"182","This skit is very dramatic. You will laugh or think about the things around you.","10","19 April 2019"
"183","After 2013 the show declined! To get the full effect of Family Guy! You need to start it from episode 1! It's good enough to binge despite FOX canceling it twice!","6","13 July 2021"
"184","Do you know what's funny? I'm actually having a Family Guy marathon right now. Seriously, Family Guy is on my TV right now. I'm listening to Peter Griffin sing.I love this show. It's freaking hilarious. It's one of the best shows on the entire planet. I used to walk past my Dad watching it, and go, ""oh, that's stupid"". No, it's not. I was ignorant. I had not yet learned the magic of Peter Griffin. I remember when I started watching it, every opening song, when Stewie says ""laugh and cry"", I used to laugh my ass off. It was so funny.My favorite character has to be a tie with Peter and Stewie. They're so funny, and these are the reasons why I love them. Peter is an idiot, but very lovable. He's very funny and always makes you laugh. When he acts like a child, but not meaning to, he's hilarious. When he gets footy pajamas, and he electric shocks everyone, it's hilarious. When he goes ""oh, shiny red ball"", it's hilarious. When he goes ""butt scratcher! Butt scratcher!"", it's hilarious. Needless to say, everything he does is funny. I love Stewie, because he's a baby that is an evil genius, who wants to murder his mother. He builds time machines, but still loves his teddy bear, Rupert. Is sort of gay, I honestly don't know if he actually is. I think that's part of the mystery that Seth MacFarlane gave us. Only a few people can understand him, but you don't really know for sure who can, other than Brian. And for some reason, he has an English accent. I don't know why.My next favorite characters from the Griffin family, are Chris, Meg and Lois. In that order. In every TV show, I manage to really hate one character, for some reason. I honestly don't know why, it just seems to happen. And in Family Guy's case, it's Brian. I just find him so annoying with his politics and talking about religion. Just stop it, Brian.My other favorite characters, that aren't in the Griffin family, are Clevland, Joe, Quagmire, Mayor Adam West, Mort Goldman, the chicken, and many others. Too many to go into great detail about.Anyway, I think I've ranted on enough. You can see by my great detail, that I am in love with this show, and I think it's a wonderful thing I can look forward to every week. I honestly don't know how it got cancelled twice, but I do know, you can't keep Family Guy away. It will keep coming back.Overall, I give this show a 10 out of 10.","10","17 October 2014"
"185","This show has the creativity that the Simpsons has lost due to its many years on the air.  While other shows have gotten stale, Family Guy has a fresh feel.  And it seems a lot more raunchy than the any other animated series.  I've been seeing more and more animated series on TV to capitalize on the Simpson success, but Family Guy has the most promise.  This show along with Futurama gives Fox a lock in animated comedy.",NA,"1 August 2000"
"186","Family guy is the only animated show at the moment that can even rival South Park, Futurama or The Simpsons. The writing is some of the most hilarious and offensively brilliant wit you will ever here. I also like the way the episodes are structured, flashbacks, references to commercials, old TV shows and classic art house films. There isn't an un-funny line in an episode. It's not quite on the level of the Simpsons, but give it a couple of years, and you could be surprised.",NA,"2 September 2001"
"187","Woah. Family guy has really fallen. Season 19 is by far the worse season I've seen.","1","16 July 2021"
"188","For years, THE SIMPSONS was the undisputed champion of topical animated comedy. Sure, BEAVIS & BUTTHEAD tried their best. But it usually came down to a one-joke idea that didn't go very far. Comedy Central then had SOUTH PARK, a worthy competitor. Finally, Seth MacFarlane and his team of animators came along and set up shop with FAMILY GUY. And since everyone knows about the series, I won't bother going through a synopsis of the characters. But typically, the formula for a show is this: one-liners, zingers, usually a musical number, at least one fart joke, perhaps an extended fight between Peter and a chicken, all revolving around a loosely-held-together plot. Overall, the series is funny. Though some of the jokes are a little too off-color, even if you're someone not easily offended. Some of the running jokes go on too long, also. Personally, I like the episodes that feature Stewie and Brian more often. Their banter is really witty. So, take it or leave it, FAMILY GUY is here to stay. Might as well have a few belly laughs, so long as you hang up your morals!","8","9 June 2015"
"189","This cartoon, although at times (most times) politically incorrect is the funniest thing I have ever seen! It is definitely for adults or teenagers, I am 17 and love it! It brings all the things people think and are to afraid to say to our screens! It also brings very random very entertaining scenarios which no real person would live through! This show is full of bathroom humour and is not at all ashamed to laugh at anything. I'll admit there have been a few episodes where I have felt the writers have been distasteful but overall I can not fault this programme! I'm sure many people would find this programme vile and i suppose it does have an acquired taste, (and after I gave a rating of 1 star to the Godfather trilogy many people are going to think i'm nuts!) but this programme is amazing! It is The Simpsons but ruder with a fat man, his skinny, beautiful wife, a daughter everyone hates, a son with an evil monkey in his closet, a talking college-drop out dog and a baby hell bent on killing his mother this show is a must see!","10","7 June 2007"
"190","I'm currently going through and watching from S1E1 right until the latest episode, currently 10, almost 11 seasons in and I do think the first 4 or 5 seasons were better, and the feature-length episodes do get a bit tedious, but overall I just think is comedy gold. It's not a classic comedy, it's more ridiculous, childish things that make this show funny - the low maturity level of Peter, the cutaways, the ongoing jokes with the chicken and THAT song. I watch an episode every day with my dinner, often two a day in fact. Whilst some episodes often pass me by without making me laugh and are forgettable, 9 times out of 10 there's a few moments in every Family Guy episode that make me crack up!Not one to watch with the family, but certainly one I'd recommend.","8","12 October 2018"
"191","I like it when fat funy fall down in this cinematographicaly masterpiece, whern wrold renouned comedianne Seth MacFarland takes on abusive parents, dysfunctional familes, and the disintegration of the traditional sitcom in tjis postmodern masterpiece,hold on my dad wants me to mow the lawn brb.","10","12 February 2021"
"192","This show suffers from a lack of plot and character structure and it shows more and more. Family Guy was always about gags and clips, but the first few seasons, as compared to now, had at least some thread of a storyline. Peter was somewhat of a dad and even one episode had him have a moment with his son, Chris. As of present, all of the characters are interchangeable. Stewie, has ceased to be evil and ambiguously gay, and is now just another one dimensional character.Family Guy could literally be just one mouth spewing lines followed by a clip and be about just as entertaining. However, this show will never lose its fan base because of the first few very funny seasons. The Simpsons, what is now a much worse show than Family Guy, has stopped being funny for the last 6 years and it's still on.","6","22 March 2009"
"193","This is the most wonderful show currently in production. Peter Griffin is the most cleverly written character on television. The inescapable, pythonesque (expanding, technologically, verbal slapstick to cartoon wackiness), barrage of humor that a single episode subjects you to, is on a large scale incredibly stream of consciousness, and on a small scale, supremely witty and representative its culture. It's rare that a show will assemble such amusing characters without a single, forced, moral thread. It's perfect, the way Lois' status as the straight woman complements Peter's utter insanity, and the stock goober characters the 'Simpsons'-aged children play, to the replaced by a overwhelmingly more interesting and intelligent dog and british infant. It's worth watching, treasuring, and getting tapes of, and mailing them to all of your friends. Peter's flashback/dreamlife vignettes are unsurpassed. 'Bout time something like this made its way to television.",NA,"30 November 2000"
"194","Family Guy is a classic with his crazy concept and maniac family members. A lot of people says it's a copy of The Simpsons but it's wrong because The Simpsons never this funny.Peter Griffin and Stewie Griffin are amazingly funny and everything they do just hurts your mouth. Lois and Brian are secondary funny characters with a lot of funny things they do.Meg and Chris are just little funny characters sometimes do funny stuff.If you still didn't watch this show you can start now. But believe me you will laugh so much. 9.3/10Best Seasons: Every season to date","10","13 February 2011"
"195","I am nowhere near you're friend's and a actually used name wasn't there but I'm trying to figure out how and it's so much easier don't you think. If I stop by while the counts still that high you are no different so indifference you play it right on the head huh?","10","31 January 2022"
"196","This is one great show, that it makes me wonder why it got pulled off the air so many times. But I believe its now here to stay! This show cant compare to any other, Before Simpsons was pretty ""on the edge"" and than came Family Guy, and they are stretching it out to go off the ""edge"". The things this show gets away with is incredible. Totally work the watch! If you like the Simpsons you will LOVE Family guy!","9","27 December 2001"
"197","Sorry, but I just don't understand, how could people think this is better than the simpsons? The simpsons is a classic, this doesn't even deserved to be mentioned in the same sentence as the simpsons. I don't know how people would find this funny. The simpsons and Family guy was sort of similar in that it makes fun of the society. The simpsons is offensive but it's funny. I never laugh once at family guy's episodes. I don't like the evil baby, don't like the mom the dad or the daughter, the only one i can bear is the talking dog.And I don't laugh at any of the intended jokes, i rather have homer's ""oooh...doughnut"" anytime.The Simpsons is witty, hilarious and have some heart and soul in it. I like it that even though Homer is selfish, greedy and lazy but he truly loves his family and that makes him lovable.There's some kind of depth in the series.The characters in family guy is just annoying.In my opinion, this tried to be in the same standard as the simpsons but failed miserably. This is just a shallow piece of garbage which tried to offend as many people as possible.I find it an insult to even compare it to the simpsons. Sorry, but that's just the way i feel.",NA,"27 December 2004"
"198","This show, featuring such classic characters as Stewie Griffin, the homicidal baby, is so funny that it could coax a smile from a dead man. Despite the fact that most of the jokes are insulting in some way, you forget the slight to your culture, beliefs, etc, because it's just too funny! Even the jokes about Jesus and God are hard not to crack up during. The main characters are as follows; Peter Griffin, the fat-ass, moronic husband, Lois Griffin, the sexy, good and yet dirty wife, Meg, their eldest daughter who just doesn't fit in anywhere, Chris, their artist son who's about as dumb as a tent-pole, Stewie, the baby who wants to rule the world and kill his mother, and, last but not least, Brian, the artsy fartsy talking dog who spends the day boozing. This family of misfits makes it's way through their lives in the unconventional and (at times) sickening town of Quohog, Rhode Island, populated by such characters as Quagmire, the horny next-door-neighbour, and Tom Tucker and Diane Simmons, the insulting, ridiculing pair of news anchors. Even though the way there may be gross and twisted, at the end of each episode the family learns important lessons, no matter how they are masked by the jokes and parodies. This gives the show the brief morality it needs to stay on the air - thank god for that! All in all, Family Guy is an insulting, degrading romp full of characters that are, simply put, horrible people. It is a regular splinter in the ass of the censors, and a terrible role model for kids whose parents let them watch it. But, hey, that's why we love it.","10","21 June 2008"
"199","When Family Guy first came on back in '99, I heard it was a good show and I decided to watch it. I knew it wouldn't be better than The Simpsons. I mean come on...No cartoon is better than The Simpsons...Right? WRONG! I was hooked on Family Guy right away. It was the funniest thing I'd ever seen on TV in my life. Each and every week I sat down to watch it and I laughed until it hurt each episode. Seth MacFarlane is a true genius to come up with a premise like this. A man on the verge of mental retardation is married to a boring housewife, raising three children. Chris, the dim witted son, Meg, the geeky daughter, and last but certainly not least, Stewie, the baby, and the most intelligent one in the family, except for perhaps Brian, the family's martini sipping talking dog.Part of what makes Family Guy so funny is that it's always on the edge of inappropriate. The show says some pretty rude things about many different cultures, religions, races, and creed. However, they just barely stop at the boundary where it becomes not funny. Family Guy is ripe with smart, political humour as well as disgusting toilet humour, making it a show that could make almost anybody laugh. I personally love Family Guy's ability to attack everything with a parody. As a movie lover, to see so many movies spoofed and picked on, it really makes me laugh.Family Guy is brilliant TV and, unlike The Simpsons which has been dropping in quality lately, it will continue to be brilliant for years to come.10/10","10","7 May 2006"
"200","If I were just talking about the first 3 seasons this would be 10 stars. The first three seasons were the funniest TV show I've ever seen. It was fast paced and unpredictable. now they like pitching jokes that are long instead of fast paced and witty. Now a lot of the jokes are not as funny because its more predictable and slow. They used to have all sorts of jokes, now its much more limited. They use crappy CGI and stewie isn't as diabolical. Peter also sounds different"" he used to speak faster and did things out of lack of common sense rather than pure retardness. When the show was more censored they had to be clever and use""fin-sucked-do-barry"" as an insult(which was funny and unpredictable). I think they should watchseasons 1-3 and make more episodes like them.","6","3 December 2007"
"201","I tried to watch ""Family Guy"" on at least a dozen occasions during its initial run on FOX. I could never make it though a single one, flabbergasted as I was by how desperately the show was trying to be funny and ""edgy,"" and by how miserably--and consistently--it failed. Lame as lame-ass can be.",NA,"14 April 2003"
"202","This show is so fricken funny that I almost rolled of my bed it is so good too","10","22 November 2020"
"203","Before any Simpsons fan-boys bash me with insults, let me first say that I love the Simpsons too. And for the record, I also love South Park.Please note that even though Family Guy is funnier than the Simpsons, that does not necessarily mean that Family Guy is BETTER than the Simpsons. South Park is the funniest of all the three but that does not make it the best of all the three.In my opinion, the flashbacks in Family Guy are the funniest of all. I mean, so what if it diverts the story a little? I am looking for comedy. Not a deep story or a lesson of some sort. There are thousands of other shows that can give you a story or a family lesson. Seth Macfarlane's idea is to make people laugh - and he is a success at expressing that idea.Sadly, it seems that all the criticisms regarding the show have affected the crew of Family Guy. In the newest episodes, there are fewer flashbacks and the jokes seems to be diminishing as well - all thanks to the critics who love to compare and contrast.I love all the three cartoons. But never in my years of watching all three of them have I compared them against each other. I recommend to the critics to do the same.","9","11 October 2007"
"204","Its like hearing an extended fart while doing what most humans do. Which could be a full life of strolling the streets of new york staring at buildings.","1","17 July 2020"
"205","Family Guy I have to say is one of those shows that keeps you coming back for more. This is a very funny show filled with ridiculous but realistic plot lines funny voice acting and great animation. of course I can't review this show without talking about the infamous cut aways. The cut aways are basically the running gag in the show where they get off topic and show you some tihng very funny. My favorite episode has to be "" The Man With Two Brians"" where the family gets a new dog to compete with Brian. Definitely check this show out If you do not want to have a rational man.Rated TV-14 DLSV For Suggestive Dialouge, Language, Sexual Content And Violence.30min.Numerous uses of the F-word.****/****",NA,"3 November 2011"
"206","I can see Seth whateverhisnameis pitching this show to Fox.Seth: I have an idea about an animated average family that get into a lot of wacky adventures.Fox: Like the Simpsons? Seth: No. The Dad of this family will be a sports loving beer drinking loud mouth moron who's stupidity gets him into all kinds of trouble.Fox: Like Homer Simpson? Seth: No. This guy will have hair and wear glasses and have a different name. The Mom will be long-suffering and have a weird voice.Fox: Like Marge Simpson? Seth: No. Her voice will be whiny and annoying and unpleasant to hear. There will be three kids one of them a baby.Fox: Like the Simpson kids? Seth: No. The oldest one, a boy like Bart Simpson, won't get into trouble he'll just be annoyingly stupid with an annoying voice to match. The middle one, a girl like Lisa Simpson, will be boring as hell, but the baby for some unexplainable reason will be super smart and always getting into trouble. Like Bart and Lisa but it will be one person. And people will be able to understand him which won't make any sense since he's just a baby. See they'll be different than the Simpson's kids. Also I'll threw a talking dog into the mix who is smarter than the rest of the family but oddly still hangs around them. See that'll really make it different than the Simpsons? Fox: Good Lord, we can rip off an already popular show and sell double the advertising space and DVD's. Brilliant. You're copying the Simpsons but with just enough changes to fool the sheep.Seth: Well, thank you. I've already got enough third-grade potty humour and sexual innuendo lined up for a couple of season's worth of scripts. That way people will say it's ""fresh, cutting edge and outside the box,"" plus we can watch the first couple of seasons of the Simpsons and change the wording to a lot of their jokes, people won't remember that far back. Of course we won't be able to get any real name brand stars for guest appearances because they always go on the Simpsons or King of the Hill. So to save on the budget we'll have the same couple of people imitate stars, they won't even have to change their voices.Fox: Brilliant, we have a deal. Now we just need a ""King of the Hill"" rip-off and life would be grand.",NA,"20 July 2005"
