"","content","rating","date"
"530","On it's original run (Seasons 1-3) the show is an 8 out of 10. Now this is pure garbage. This is on season 12, and it hasn't been canceled yet, it's filled with horrible, random Cut-Away gags, Time Fillers and more bad stuff to waste your f***ing time. The DVD's are pointlessly uncensored, despite the lack of real nudity and bleeped swearing. I get sick on how many times i'm hearing ""Giggity"" everywhere, this stupid euphemism for ""That's what she said"" is dumb. I'm baffled that this has an 8.4 on IMDb, while Home Movies has a 7.7, I don't get it, Home Movies is WAY better than this sh*t. Peter is a rip- off of Homer Simpson, not in a subtle way, it's blandly obvious. The world could be a better place if they just cancel Family Guy, and bring back Futurama, that being said, if you want to get into a good series, watch Futurama, even in it's bad episodes, it still stands funny, American Dad is also recommended.Overall, American Dad is better, Family guy gets a 4/10","1","18 November 2013"
"531","The simpsons really are getting a little boring, despite excellent efforts from the writers. FG's real competition, is Futurama. It is obvious from looking at early pilots of FG that MacFarlane didn't get nearly as much leech with FG and Matt Groening got with Futurama. But the only character that really suffered is Peter. Don't get me wrong, he's fun.. He's not very un-origional. And while Futurama does not have any really un-origional characters, the just don't have any as colorful as FG. I'm thinking of Stewie and Brian ofcourse. Stewie really is a classic. Diabolical little genious, future leader of the world, mocking people while they change his diaper ""Yeeesss.. You like cleaning my poo don't you??"" Brian too though, a synical, well-read snob, and full blown alcoholic. Meg really is what she is in the show... Boring. But she does do it well :) There isn't much to say about Lois either. It's a close race, but I supose FG's warped humor just really appeals to me.",NA,"6 February 2002"
"532","I can't remember the last time a cartoon made me laugh with such utter vulgarity and craziness!! Where do I begin?? I think that makes the show are the flashbacks. This isn't a show that leaves a lot to the imagination, it SPELLS EVERYTHING OUT for you, which is hilarious. For example, Peter makes a comment that he didn't fart until he was 18. Then we see a flashback of a younger Peter, and we hear a fart and Peter looks around and says, ""what the hell was that??"" BRILLIANT!! Also, the tv anchors Tom and Diane are hysterical. If only local news had more people like them!! Quagmire is my favorite character, and I laugh every time he says ""giggidy giggidy giggidy!"" Also, the Evil Monkey in Chris' closet is the best!As funny as this show is, it is definetely not for kiddies. There are some times when I have been boarderline offended, and I am NOT one who is prudish. One example of this show pushing the envelope is when he is asked to babysit for the Griffin children, Quagmire sites Megan's Law as the reason why he can't do it. That's just creepy. But then he babysits anyway!! Shocking stuff.As many times as they make my jaw drop, these characters can also sing and dance!! I'm a huge musical theatre fan, So I LOVE when they spoof different shows. Epsecially the episode where Peter becomes the theatre director, and he keeps changing everything around. When Lois expresses her dissaproval at all his rewrites ,Peter says ""I thought you wanted a good show! if you wanted to do a bad show, we would have just done RENT!"" this made me laugh espesially hard, because RENT is my favorite musical ever =)Well, i've babbled on long enough. I would just like to end with saying, Seth is a comic genius!!!",NA,"23 February 2004"
"533","I have never really got into another cartoon show, until I'd seen the previews of this show!  I watched it when it came on after the Super Bowl, and I laughed 'till I choked!  I say, this is one of the _funniest_ cartoon sit-coms ever!  I can't wait for it to become a regular show when it comes to FOX!I think this show is better than the lunacy of The Simpsons, Beavis and Butthead, and South Park, those are shows I don't like anyway.  My favorite parts were when Peter tried to contact his angel good side and the angel was in the middle of the traffic jam!!!!!  LOL!!!!  And the Kool-Aid man bit crashing into the courthouse, classic!!!  The characters are funny, too, you got the fat, lazy Dad, the son who's just like him.  A morbid, and depressed teenage daughter, a disapproving Mother, a homicidal baby, and a talking dog whose the only sane member of the Griffin family.  ;-)Let's hope Family Guy becomes a popular show!!!!!",NA,"14 March 1999"
"534","What more can you say about Family Guy other than it replaces the Simpsons as the flagship of animated mass-market (non-cable) prime time entertainment. This is not a knock to the Simpsons- they have been and still are shaping the landscape with their innovative writing. Family Guy has pushed the envelope past good taste, common sensibility, and even adherence to 30 minute sitcom guidelines.The rough skeleton of the show serves as a superstructure for comedy bits which would be impossible to segue to otherwise. The illogical jumpiness of the main plots (Which are sometimes thin) to the gutbusting asides is the focus of many of the series' critics. I can only ask that those watching the series critically to get past this- suspension of sitcom guidelines is essential to enjoyment of Family Guy.It's not ""The Simpsons"", and it's not ""Everybody Loves Raymond"" (thank God). It's Seth McFarland's masterpiece, and if you don't take it seriously, it's really darned funny.","10","9 November 2006"
"535","This has got to be my all-time favorite show!, i noticed a lot of people have been comparing it to the Simpsons but this show is in a league of its own! I personally don't find the Simpson's very funny at all, but this show is guaranteed to have me in stitches at least three times every episode. My favorite characters are Stewie, the Mayor of Quahog,""someone's stealing my water"", and Chris who i believe deserves much more air time but every time he appears on the screen i practically wet myself laughing. I bought a box set of this not expecting much as i hadn't seen much of it but i was addicted and have watched it many times over. I have lent it to all my friends and every time someone brings up this show we all quote our favorite lines because this show is 'classic'. I live in Australia and i am very annoyed at Channel 7 for taking this off the air and putting it on at very late time slots. Anyways, if you have not had the pleasure of viewing this show yet then do as it is gold and i just want to take this opportunity to give my congrats to Seth Mc Farlene for creating this piece of genius!","10","30 August 2006"
"536","Here's a case of revisionist assessment of a television show wherein people grow fond and soft and warm towards something that was 'unjustly' maligned and received poor ratings then got canceled (ie Twin Peaks).Make no mistake: this show sucked when it was on and it will suck now and forever.  It takes more than a succession of pop-culture references to qualify as 'humor'.Don't let this show become thought of as one of those 'brilliant, canceled gems'.  It is not. It is crap. Bad jokes, bad drawings, bad voices, and bad, bad ideas.",NA,"8 September 2003"
"537","The first 2-3 seasons were ok... Never utterly hilarious, but good for a few laughs. It hits on some topics that are quite boring, and some of the gags go on way too long; for example, when Peter falls and hits his knee or whatever, he moans forever. The video cutscenes are super annoying and also go on far too long. It's almost like they needed fillers.
It's gone downhill after about midway through its run, I suppose. I just don't laugh anymore.. it's just not funny enough to keep me tuned in. Some of the skits and overall theme of many episodes are boring.It's ultimately forgettable and doesn't hold a candle to some other animated series like Beavis and Butthead, Simpsons and King of the Hill, which are all far better than Family Guy.","4","21 May 2020"
"538","I have to thank my wife to be to introduce me to this show in the UK. In fact - I don't even know if it ever aired here but thanks to Series 1-2 being available on DVD - I have been watching them.It combines the cartoon skills of the Simpsons with the anarchic edge of 'South Park' - without going over the top on gross humour. It is hard to see why anyone would like the oafish, insensitive and culturally uninterested Pete - but it works very well. What are liked about the show was it 'fantasy trips' when someonementions a subject - and you see the main characters in that situation. And it doesn't have the 'let's be cute' approach that I think always lurks around in the Simpsons. So my advice to fellow Brits - if you cannot find this show - ask a friend in Canada or USA to get you send a DVD set of the 'Family Guy' thisChristmas !",NA,"21 October 2004"
"539","Family Guy is, without a doubt, one of the funniest shows ever to grace the small screen.  The show itself is an animated masterpiece that doesn't often rely on the old gimmicks of situation comedy.  It is as irreverent to as many subjects as possible.  Another element that truly aids in the show's hilarity are the many obscure references to movies like Tron and show's like ""The Facts of Life.""The ensemble cast is stellar and all are perfect for the characters they are voicing.  The creator, Seth Macfarlaine, does many of the character voices including Stewie, the tyrannical baby with plans for world dominion; Brian, the sarcastic and alcoholic family dog; and the family guy himself, Peter Griffin, who gets into more trouble than any man should.  Alex Borstein does a fine job voicing the family mother, Lois Griffin.  She also voices many of the female stock characters such as news anchor Diane Simmons, Asian reporter Tricia Takanawa, as well as many others.  Seth Green's rendition of Chris Griffin, son of Peter and Lois, is hilarious and perfectly suited to him.  Mila Kunis did the voice of ultra-reject daughter and sister, Meg Griffin.The show also featured a fabulous group of guest stars which includes Adam West, all of Kiss, Jennifer Love Hewitt, Bob Barker, Candice Bergen, Ed McMahon, Kelly Ripa, and Wallace Shawn.Overall, the show was a comic masterpiece and was cancelled far too soon.","9","1 November 2003"
"540","Among the many problems is the father's constant bad behavior, mostly his complete lack of manners, He beats up everybody all the time, He kills people and the Cops just let him go so easily. ""That is so BS"".I must say I have to agree with some other reviewers here - Peter does and says lots of bad things, His voice is so nasally and Annoying much as his Wife Lois. Basically, Peter never cares about her until the end in Every episode this was a complete waste of time. I really Hate Peter the Mean Spirited, Fouled Mouth, & Childish Father. His Main Catchphrase is ""Da**it"", he said it in almost every episode & I hate that word. It really bothers me & become very I'll Tempered and have Temper Tantrums and also break people's things. This is why Family Guy is a Bad Influence on Kids & Adult with Disabilities.This show is nothing but annoying. I don't know why it was created, and I don't know a single person who claims to like the show. It teaches the audiences to be rude, disrespectful, act violent, & Racist.","1","20 January 2022"
"541","**DEFINITE SPOILERS AHEAD**Some people have referred to this as part of the brilliant tradition of the Simpsons, but they couldn't be further from the truth. ""The Simpsons"" has (usually) been a brilliant parody of the flaws of modern U.S. society, mocking our wan acceptance of mediocrity, cleverly criticizing the unfairness of the U.S. economic system, and generally critiquing the remnants of racism, sexism, anti-Semitism, and homophobia which still taint our society. ""The Family Guy"" is the reverse.""The Family Guy"" imitates the taboo-breaking humor of Y2K comedy to camouflage its reactionary stance.Skeptical? Take a look at the episode attacking gun control.The way Peter Griffin's family treats him is the reactionary right's ideal of male privilege: he can be completely selfish, self-absorbed, violent, outright cruel to his children, and yet he is still treated as the head of the family For No Other Reason Than He Is The Father/Husband. This is not a good-hearted man who stumbles; this is an argument that merely being male is sufficient justification to dominate all others.Lois Griffin is the reactionary right's ideal woman. No matter how much her husband puts himself before her, she remains loyal to him. She has no sense of identity beyond her roles of mother and wife. In one episode she took on feminism to promote stay-at-home-mom subservient wife values.Stewie Griffin fits perfectly with the Dobson explanation of children. Read the Focus on the Family propaganda and you will encounter the steadfast belief that children are born evil and an eerie return of the Victorian belief that the evil must be beaten out of them. Thus Stewie promotes the idea that there are no innocent children, justifying the reactionary right's delight in corporal punishment of those younger and weaker than the average adult.The Griffin family solution to almost everything involves violence and a distrust of outsiders. Peter happily beats up anyone who disagrees with him. Sometimes innocent bystanders are killed off for a laugh, but as long as that person is not a member of the family, no one cares.I could continue, but I think I have made my point.""The Simpsons"" is the sort of program which points out to us how we need to improve ourselves.""The Family Guy"" is the sort of program which rationalizes excuses to remain just as lowly as we are at our worst.",NA,"5 November 2004"
"542","I've been following Family Guy ever since it first aired and like many others was angry at FOX for canceling it in 2002. At the time, Family Guy was unique because it blended pop culture from yesterday and today due in part to its cutaway gags. When it returned three years later, it hadn't lost its edge and was still funny as ever.However, the show began to lose its focus in the following seasons; I guess you can say that was when the new material settled in. The writer's strike back in 2007 further damaged the show. After the strike ended, the show became stale and even gut-wrenching at times instead of downright hilarious. It's now come to the point where I don't devote my time to watching the show anymore for a variety of reasons.The main reason I seldom watch Family Guy is because it's become too politically preachy. It has delved into some controversial topics that were improperly handled (i.e. revisiting the Terri Schiavo incident which happened five years before the episode aired). While most satirical shows criticize the left and the right, Seth MacFarlane only evangelizes his own beliefs, meaning he only argues for one point and against another. This is what American Dad is for, not this show.I prefer the characters back when they weren't fully developed; now Peter acts and is looked down upon like a whiny five-year old, Meg is constantly treated like crap, Brian is the preaching atheist, etc. The fact that Seth has a carbon copy characters on every show he has (Devoted but absent-minded father, driven-to-the-brink-of-insanity housewife, teenage daughter who's trying to fit in, socially awkward son, at least one talking animal or young child, etc.) also makes me question his creativity. It's also become obvious that he purposely wrote Cleveland out of the show in a desperate attempt to get black people to like him (I'm white and I think The Cleveland Show a disgrace; not just to blacks but to rednecks as well).Bottom line: Family Guy was in its prime in its original run and for the first season of the return.","4","24 January 2011"
"543","FAMILY GUY IS THE FRIGGIN BEST SHOW ON TELEVISION, THE WHOLE THING IS PERFECT! Seth MacFarlane is one of the greatest minds to hit television, and I'm so glad he did. He took funny to a new level, knowing full well that he was not limited by the laws of human nature with an animated series. He knew EXACTLY what it meant to have an animated serious. It meant he could do ANYTHING he wanted to with it. The show is quick witted, fast as lightening, jokes come from everywhere and they are all so perfectly timed and well organized. Some people say this show is dirty, filthy, blasphemous and racist...well you're damn right it is but there is not ONE thing that these guys left out to make fun of. They tackle every race, every religion, every celebrity, every potty joke, every sex joke, they get it all, so I think that by being SO racist as to make fun of everyone, they aren't really racist...see where I'm going? huh? It's OK, you don't have to. This show is the best. Laugh at yourself to you're bound to feel insulted in some way. Funniest show ever.",NA,"22 September 2005"
"544","Jokes against religious groups should be frowned upon. They don't know when to draw the line. They have also lost their touch over the years; it's not as good as it used to be. Watching bobs burgers instead.","1","5 April 2020"
"545","This is one of the funniest shows to be on primetime television.  No, sorry, THE funniest show on primetime.  Sure, The Simpsons have their moments, but they're diffinantly getting old.  It's nice to have some fresh, new jokes. Funny ones, too.  Seth MacFarlane has created an animation masterpiece.  Now don't mess it up...",NA,"23 July 2001"
"546","Family guy was never really anything above average, but these recent seasons, good god what happened.Like the shows gone from pretty average to absolute rubbish with these recent seasons.It's just so boring, all the jokes boil down to either, reference or racist stereotypes, yes Seth I do know what back to the future is, oh my god Seth what if Marty was black, what if, what a revelation, you truly are a comedy genius mr McFarlne, you truly are.","2","15 July 2020"
"547","Okay yes this show can be laugh out loud funny at times but as someone who sat through every episode that has aired to this date I can't say I even like the show. Sure there can be a good even great joke every episode or 2 but sometimes there is none. Also almost every single character becomes assholes as they're worst traits are only heightened with the shows run time. Sure I did for the most part enjoy the very early seasons of the show but they definitely still had issues with characters among other things but the show gets worse and worse even though I see very small improvement in more recent episodes. Not to mention when this show tries to be serious anytime after the first couple seasons it falls flat on its face and it's almost insulting. This show overuses jokes and ideas as well. I could go on and on but to conclude I don't recommend this show unless you maybe have a good episode guide to tell you some good episodes or if you're just looking for a rare laugh or you're with your buddies because that can make it a lot more bearable.","3","16 March 2022"
"548","If Family Guy offends you or you simply don't get the humor, unfortunately this show is making fun of you and the masses of overly religious, dull, and politically correct people in America. So put your morals aside and have fun with this show. FG is a hilarious mind opener on the reality of today's society. Whoever said this show is for a young immature audience is very mistaken. With all the references to old movies and politics 10-80 years ago, I couldn't imagine any young immature kid finding this funny. Family Guy is definitely for a mature open-minded audience who are not afraid to criticize American society. Hats off to Seth and the whole crew who were able to make this show happen.","10","15 December 2008"
"549","The Shark is just waiting to be jumped.Leave it to Fox to cancel the show while it was still good. That's always been the pattern of many really good shows. Brought back with the help of a strong fanbase, Family Guy should have stuck to the original formula that had made it funny. True, it was raunchy, it was scandalous, it was blasphemous. But it was tight, and that's what made it work.Now, Family Guy's problem is they think they can get away with anything. It's what I like to call the ""dictator effect."" Bear with me. In their early stages, a dictator's reign is often on thin ice, but they often initially want to help their people. But as they solidify their standing, they'll consolidate power until it would be a death sentence to criticize them. Family Guy is no different.Comedy is comedy, but you reach a certain point where it ceases to be this way. Family Guy has replaced jokes like ""did you know Jesus and Moses used guns to fight the Romans?"" with ""I have Down's Syndrome and my mom is Governor of Alaska."" If the writers of Family Guy are trying to make a political or social statement, they go about it the wrong way. The best jokes about pop culture are being replaced with the worst jokes about abuse, abortion, homosexuality.I do enjoy most of the pop culture references on the show, especially when I've observed what they're trying to convey. Who thought Liam Neeson's American accent was awful? I did, and I'm glad to know Family Guy did too. But it's losing its touch. If Dennis Miller was being tortured into doing a show, that is what Family Guy is like now. The awkward jokes that drag on for a minute or more are just awful. We understand that the music video for Dacing in the Street was gay, but do you have to show the whole video just to prove your point? In the sense of the bigger picture, Family Guy is the prime example of the declining value of comedy in today's society. We have lowered our expectations, and so we get this. Comedy used to be about a good punchline and careful observation. Now it almost brings a tear to my eye to see what has happened. Look at those Comedy Central roasts they do. If you want to see what comedy is really about, look up the Dean Martin roasts on youtube or watch Sinbad. But now? Vagina? I just booked me a spot on the Tonight Show. Sex? I'm winning me a Mark Twain Prize! In conclusion, Family Guy is still a pretty good show. Not great, but not as bad as some of the other shows out there. But those writers need to get their act together. No doubt they were going to hell for presenting such blasphemous material. But now they can't go with a smile knowing that it was still funny. Instead, they have only their regret to contemplate.","6","8 December 2011"
"550","This is the best show. It's so stupid that it makes you laugh and laugh. Peter and his family are the weirdest family ever and the jokes are a lot risker than the Simpson's comedy. This makes it a different kind of entertainment. This is one of the best cartoon shows ever.",NA,"26 January 2004"
"551","My favorite episode was the one in which Joe, the man in the wheel chair, entered the special opympics, or whatever it was, to prove that he was still a man.  I don't think that this episode, overall, is better than the others, but I choose this as my favorite simply because of the scene with the reporters giving their intro to the games.I thought it was crazy funny when the male reporter was saying how we just might have a good laugh at their expense and the female reporter says, ""Oh, I know I'll be laughing,"" to which the male reporter replies, ""Yes, after this is over, I'm sure we'll all be going straight to hell.""  Of course, I'm paraphrasing here, but that scene was just evil and hilarious.My favorite quote, if I got it right, is when Peter tries to escape from Death by running away from him and Death calls out to him, in a laughably unimpressed tone, ""If I could catch Flo-Jo, I can catch you!"", Flo-Jo being the Olympic track star who had died recently as of the first airing of that episode.  Again, evil and hilarious.",NA,"3 June 2003"
"552","Now that Stewie the Baby can travel back in time to save Brian from death, the writers should be capitalizing on a South Park Style ""Kenny/Brian,"" series of horrible, disgusting, mutilations of Brian being repeatedly killed. Then Stewie just hops in the time machine to bring him back.This is a missed opportunity to indulge in ""black"" humor, that Brian the Dog could be mashed, mangled, shredded, and horribly destroyed, but still return to continue the episodes.I only give the show a 7, as it is not using its potential.","7","26 November 2017"
"553","The premiere episode was very funny, witty, sharp.  The second episode, though, fell thoroughly flat.  The third episode got off to a good start, but fizzled halfway through.  Here's hoping the writers hit their stride",NA,"27 April 1999"
"554","Family Guy is by far the funniest show that ever graced television (and when I say funniest I am saying that FG is funnier than South Park, Simpsons, and Beavis and Butthead). This show is everything that the Simpsons want to be. I believe that Seth MacFarlane [creator of FG] has created a way funnier show than Groening's Simpsons. Unlike Simpsons, Family Guy is actually funny. The show's clever jokes never get old and Peter Griffin has dethroned Homer Simpson.Personally, I think Matt Groening saw that Family Guy was a way better show that his outdated Simpsons. I almost certain he had a hand in the cancellation of this great show. It won't matter when Family Guy gets revived by either FOX, Cartoon Network, UPN, or Comedy Central. Then Groening can kiss his beloved Simpsons good-bye.","1","18 April 2003"
